{
  "$schema": "https://json-schema.org/draft/2020-12/schema",
  "$id": "https://preflight.local/contracts/analyze-response.schema.json",
  "type": "object",
  "additionalProperties": false,
  "required": [
    "schemaVersion",
    "requestId",
    "analysis",
    "effort",
    "model",
    "skills",
    "meta"
  ],
  "properties": {
    "schemaVersion": {
      "const": "1.0"
    },
    "requestId": {
      "type": "string"
    },
    "analysis": {
      "type": "object",
      "additionalProperties": false,
      "required": [
        "intent",
        "tags",
        "queries"
      ],
      "properties": {
        "intent": {
          "type": "string",
          "enum": [
            "debug",
            "optimize",
            "design",
            "test",
            "general"
          ]
        },
        "tags": {
          "type": "array",
          "items": {
            "type": "string"
          }
        },
        "queries": {
          "type": "array",
          "items": {
            "type": "string"
          },
          "maxItems": 3
        },
        "context": {
          "type": "object",
          "additionalProperties": false,
          "required": [
            "status",
            "turnCount",
            "truncated"
          ],
          "properties": {
            "status": {
              "enum": [
                "used",
                "missing",
                "not-needed",
                "unavailable"
              ]
            },
            "source": {
              "enum": [
                "manual",
                "accessibility",
                "claude-transcript"
              ]
            },
            "turnCount": {
              "type": "integer",
              "minimum": 0,
              "maximum": 16
            },
            "truncated": {
              "type": "boolean"
            }
          }
        }
      }
    },
    "effort": {
      "type": "object",
      "additionalProperties": false,
      "required": [
        "level",
        "reason"
      ],
      "properties": {
        "level": {
          "type": "string",
          "enum": [
            "low",
            "medium",
            "high"
          ]
        },
        "reason": {
          "type": "string"
        }
      }
    },
    "model": {
      "type": "object",
      "additionalProperties": false,
      "required": [
        "profile",
        "reason"
      ],
      "properties": {
        "profile": {
          "type": "string",
          "enum": [
            "fast",
            "balanced",
            "capable"
          ]
        },
        "reason": {
          "type": "string"
        }
      }
    },
    "skills": {
      "type": "array",
      "items": {
        "type": "object",
        "additionalProperties": false,
        "required": [
          "id",
          "name",
          "source",
          "description",
          "url",
          "repositoryUrl",
          "installs",
          "provenance",
          "reason",
          "confidence",
          "security"
        ],
        "properties": {
          "id": {
            "type": "string"
          },
          "name": {
            "type": "string"
          },
          "source": {
            "type": "string"
          },
          "description": {
            "type": "string"
          },
          "url": {
            "type": "string",
            "format": "uri"
          },
          "repositoryUrl": {
            "type": "string",
            "format": "uri"
          },
          "installs": {
            "type": [
              "integer",
              "null"
            ],
            "minimum": 0
          },
          "provenance": {
            "type": "string",
            "enum": [
              "skills.sh",
              "catalog",
              "installed",
              "public-import"
            ]
          },
          "reason": {
            "type": "string"
          },
          "confidence": {
            "type": "number",
            "minimum": 0,
            "maximum": 1
          },
          "security": {
            "type": "string",
            "enum": [
              "not-audited"
            ]
          },
          "evaluation": {
            "type": "object",
            "additionalProperties": false,
            "required": [
              "score",
              "threshold",
              "criteria"
            ],
            "properties": {
              "score": {
                "type": "integer",
                "minimum": 0,
                "maximum": 100
              },
              "threshold": {
                "enum": [
                  60,
                  70
                ]
              },
              "criteria": {
                "type": "array",
                "maxItems": 12,
                "items": {
                  "type": "object",
                  "additionalProperties": false,
                  "required": [
                    "id",
                    "label",
                    "maximum",
                    "points"
                  ],
                  "properties": {
                    "id": {
                      "type": "string"
                    },
                    "label": {
                      "type": "string"
                    },
                    "maximum": {
                      "type": "integer",
                      "minimum": 0,
                      "maximum": 100
                    },
                    "points": {
                      "type": "integer",
                      "minimum": 0,
                      "maximum": 100
                    }
                  }
                }
              }
            }
          },
          "knowledge": {
            "type": "object",
            "additionalProperties": false,
            "required": [
              "version",
              "hash",
              "method",
              "evidenceLines",
              "referenceCount",
              "missingReferenceCount"
            ],
            "properties": {
              "version": {
                "const": "knowledge-v1"
              },
              "hash": {
                "type": "string",
                "pattern": "^[a-f0-9]{64}$"
              },
              "method": {
                "const": "deterministic-content-profile"
              },
              "evidenceLines": {
                "type": "array",
                "maxItems": 3,
                "items": {
                  "type": "integer",
                  "minimum": 1
                }
              },
              "referenceCount": {
                "type": "integer",
                "minimum": 0
              },
              "missingReferenceCount": {
                "type": "integer",
                "minimum": 0
              }
            }
          }
        }
      },
      "maxItems": 8
    },
    "meta": {
      "type": "object",
      "additionalProperties": false,
      "required": [
        "source",
        "ranking",
        "durationMs",
        "warnings"
      ],
      "properties": {
        "source": {
          "type": "string",
          "enum": [
            "skills.sh",
            "catalog",
            "none",
            "installed",
            "hybrid",
            "library"
          ]
        },
        "ranking": {
          "type": "string",
          "enum": [
            "heuristic-v1",
            "criteria-v2",
            "knowledge-v1"
          ]
        },
        "durationMs": {
          "type": "integer",
          "minimum": 0
        },
        "warnings": {
          "type": "array",
          "items": {
            "type": "string"
          }
        },
        "importedCount": {
          "type": "integer",
          "minimum": 0
        },
        "bestSkillId": {
          "type": [
            "string",
            "null"
          ],
          "description": "ID of skills[0], the best eligible match under the active ranking and filters; null when no skill qualifies."
        }
      }
    }
  }
}
