{
  "schemaVersion": "1.0",
  "requestId": "demo-response-v1",
  "analysis": {
    "intent": "optimize",
    "tags": [
      "nextjs",
      "react",
      "web",
      "performance"
    ],
    "queries": []
  },
  "effort": {
    "level": "medium",
    "reason": "Effort reflects task complexity, independently of skill fit."
  },
  "model": {
    "profile": "balanced",
    "reason": "Choose an available model in your AI app."
  },
  "skills": [
    {
      "id": "vercel-labs/agent-skills/vercel-react-best-practices",
      "name": "vercel-react-best-practices",
      "source": "vercel-labs/agent-skills",
      "description": "React and Next.js performance optimization.",
      "url": "https://skills.sh/vercel-labs/agent-skills/vercel-react-best-practices",
      "repositoryUrl": "https://github.com/vercel-labs/agent-skills",
      "installs": null,
      "provenance": "public-import",
      "security": "not-audited",
      "confidence": 0.79,
      "reason": "Matches performance for react / nextjs. Instruction evidence: SKILL.md:2, SKILL.md:4.",
      "evaluation": {
        "score": 79,
        "threshold": 70,
        "criteria": [
          {
            "id": "purpose",
            "label": "Task purpose",
            "maximum": 18,
            "points": 18
          },
          {
            "id": "scope",
            "label": "Framework and platform",
            "maximum": 15,
            "points": 15
          },
          {
            "id": "action",
            "label": "Requested operation",
            "maximum": 10,
            "points": 10
          },
          {
            "id": "artifact",
            "label": "Output artifact",
            "maximum": 7,
            "points": 5
          },
          {
            "id": "trigger",
            "label": "Description evidence",
            "maximum": 10,
            "points": 2
          },
          {
            "id": "procedure",
            "label": "Instruction evidence",
            "maximum": 12,
            "points": 3
          },
          {
            "id": "prerequisites",
            "label": "Workflow prerequisites",
            "maximum": 5,
            "points": 5
          },
          {
            "id": "exclusions",
            "label": "Negative constraints",
            "maximum": 5,
            "points": 5
          },
          {
            "id": "agent",
            "label": "Agent compatibility",
            "maximum": 5,
            "points": 5
          },
          {
            "id": "availability",
            "label": "Instruction availability",
            "maximum": 5,
            "points": 3
          },
          {
            "id": "freshness",
            "label": "Snapshot freshness",
            "maximum": 3,
            "points": 3
          },
          {
            "id": "specificity",
            "label": "Specialist fit",
            "maximum": 5,
            "points": 5
          }
        ]
      },
      "knowledge": {
        "version": "knowledge-v1",
        "hash": "7c17361fb7dd6f9622ce5a9810dfb0ae20d2bd8f4fddbdbc0cd876aa745c727d",
        "method": "deterministic-content-profile",
        "evidenceLines": [
          2,
          4
        ],
        "referenceCount": 0,
        "missingReferenceCount": 0
      }
    }
  ],
  "meta": {
    "source": "library",
    "ranking": "knowledge-v1",
    "importedCount": 20,
    "durationMs": 0,
    "warnings": [
      "Demo fixture: illustrative content and scores, not a live recommendation."
    ]
  }
}
