{
  "schemaVersion": "1.0",
  "requestId": "demo-response-v1",
  "analysis": {
    "intent": "optimize",
    "tags": [
      "nextjs",
      "react",
      "performance",
      "frontend"
    ],
    "queries": [
      "nextjs performance",
      "react performance"
    ]
  },
  "effort": {
    "level": "medium",
    "reason": "This task benefits from investigation and verification."
  },
  "model": {
    "profile": "balanced",
    "reason": "Advisory capability profile; choose an available model in your AI app."
  },
  "skills": [
    {
      "id": "vercel-labs/agent-skills/vercel-react-best-practices",
      "name": "vercel-react-best-practices",
      "source": "vercel-labs/agent-skills",
      "description": "React and Next.js performance patterns.",
      "url": "https://skills.sh/vercel-labs/agent-skills/vercel-react-best-practices",
      "repositoryUrl": "https://github.com/vercel-labs/agent-skills",
      "installs": null,
      "provenance": "catalog",
      "reason": "Matches performance for React / Next.js.",
      "confidence": 0.8,
      "security": "not-audited",
      "evaluation": {
        "score": 80,
        "threshold": 60,
        "criteria": [
          {
            "id": "purpose",
            "label": "Task purpose",
            "maximum": 30,
            "points": 30
          },
          {
            "id": "scope",
            "label": "Platform or artifact",
            "maximum": 25,
            "points": 25
          },
          {
            "id": "trigger",
            "label": "Description evidence",
            "maximum": 25,
            "points": 15
          },
          {
            "id": "specificity",
            "label": "Specialist fit",
            "maximum": 10,
            "points": 10
          },
          {
            "id": "availability",
            "label": "Available instructions",
            "maximum": 10,
            "points": 0
          }
        ]
      }
    }
  ],
  "meta": {
    "source": "catalog",
    "ranking": "heuristic-v1",
    "durationMs": 0,
    "warnings": [
      "Offline mode: using the bundled public-skill catalog."
    ]
  }
}
